类型,问题,选项1,选项2,选项3,选项4,正确答案
single,判断题：食品生产企业应使用食品安全标准中规定的检验方法、仪器设备、操作步骤、结果判定等进行原料、半成品、成品检验。,√,×,,,A
single,判断题：食品添加剂的使用原则之一是：在达到预期效果的前提下尽可能增加在食品中的使用量。,√,×,,,B
single,判断题：食品添加剂都是人工合成的。,√,×,,,B
single,判断题：食品原料是指加工食品时使用的原始物料。,√,×,,,A
single,判断题：食用农产品包括法律法规禁止食用的野生动物产品及其制品。,√,×,,,B
single,判断题：食用农产品不包括法律法规禁止食用的野生动物产品及其制品。,√,×,,,A
single,判断题：食用农产品是指来源于种植业、林业、畜牧业和渔业等供人食用的初级产品，即在农业活动中获得的供人食用的植物、动物、微生物及其产品。,√,×,,,A
single,判断题：食源性疾病是指食品中致病因素进入人体引起的过敏性疾病。,√,×,,,B
single,判断题：同一个食品生产者从事食品生产活动，只能取得一个食品生产许可证。,√,×,,,A
single,判断题：委托生产食品、食品添加剂的，委托方、受托方应当遵守法律、法规、食品安全标准以及合同的约定，并将委托生产的食品品种、委托期限、委托方对受托方生产行为的监督等情况予以单独记录，留档备查。,√,×,,,A
single,判断题：未加碘食盐的标签可以不标注“未加碘”字样。,√,×,,,B
single,判断题：未列入“按照传统既是食品又是中药材的物质目录”的中药材不得作为食品原料使用。,√,×,,,A
single,判断题：物理性污染包括在食品中非正常性出现的能引起疾病和对个人伤害的任何异杂物污染。,√,×,,,A
single,判断题：消费者因购买、使用商品或者接受服务受到人身、财产损害的，享有依法获得赔偿的权利。,√,×,,,A
single,判断题：新食品原料生产单位应当按照新食品原料公告要求进行生产，保证新食品原料的食用安全。,√,×,,,A
single,判断题：新食品原料应当经过国务院卫生行政部门公告发布后，方可用于食品生产经营。,√,×,,,A
single,判断题：已经取得食品生产许可的食品生产者在其生产加工场所之外或者通过网络销售其生产的预包装食品的，不需要另行备案。,√,×,,,B
single,判断题：因食品安全犯罪被判处有期徒刑以上刑罚的人员，表现良好还可以担任食品安全总监、食品安全员。,√,×,,,B
single,判断题：用于食品的包装材料和容器是指包装、盛放食品或者食品添加剂用的纸、竹、木、金属、搪瓷、陶瓷、塑料、橡胶、天然纤维、化学纤维、玻璃等制品和直接接触食品或食品添加剂的涂料。,√,×,,,A
single,判断题：用于食品的洗涤剂、消毒剂是指直接用于洗涤或者消毒食品、餐具、饮具以及间接接触食品的工具、设备或者食品包装材料和容器的物质。,√,×,,,B
single,判断题：用于食品生产经营的工具、设备是指在食品或者食品添加剂生产、销售、使用过程中直接接触食品或者食品添加剂的机械、管道、传送带、容器、用具、餐具等。,√,×,,,A
single,判断题：预包装食品是指预先定量包装或者制作在包装材料、容器中的食品。,√,×,,,A
single,判断题：预防为主是指各项工作要关口前移，不要等到发生问题再查处、追责，要通过加强日常监管工作，消除隐患，防患未然。,√,×,,,A
single,判断题：在畜禽屠宰相关环节，对畜禽注水或者注入其他物质，虽不足以造成严重食物中毒事故或者其他严重食源性疾病，但符合《中华人民共和国刑法》第一百四十条规定的，以生产、销售伪劣产品罪定罪处罚。,√,×,,,A
single,判断题：直接负责的主管人员是指在违法行为中负有直接管理责任的人员，包括食品安全总监等。,√,×,,,A
