类型,问题,选项1,选项2,选项3,选项4,正确答案
多,多选题：食品安全总监按照职责要求直接对本企业主要负责人负责，协助主要负责人做好食品安全管理工作，承担下列职责（）。,组织拟定食品安全管理制度，督促落实食品安全责任制，明确从业人员健康管理、供货者管理、进货查验、生产经营过程控制、出厂检验、追溯体系建设、投诉举报处理等食品安全方面的责任要求,组织拟定并督促落实食品安全风险防控措施，定期组织食品安全自查，评估食品安全状况，及时向企业主要负责人报告食品安全工作情况并提出改进措施，阻止、纠正食品安全违法行为，按照规定组织实施食品召回,组织拟定食品安全事故处置方案，组织开展应急演练，落实食品安全事故报告义务，采取措施防止事故扩大,负责管理、督促、指导食品安全员按照职责做好相关工作，组织开展职工食品安全教育、培训、考核；接受和配合监督管理部门开展食品安全监督检查等工作，如实提供有关情况；其他食品安全管理责任,"A,B,C,D"
多,多选题：食品标签是指食品包装上的（）。,文字,图形,符号,一切说明物,"A,B,C,D"
多,"多选题：食品生产经营企业等单位有食品安全法规定的违法情形，除依照食品安全法的规定给予处罚外，有下列情形之一的，对单位的法定代表人、主要负责人、直接负责的主管人员和其他直接责任人员处以其上一年度从本单位取得收入的1倍以上10倍以下罚款：
","故意实施违法行为
",违法行为性质恶劣,食品安全总监、食品安全员已经依法履职尽责的,违法行为造成严重后果,"A,B,D"
多,多选题：食品生产经营者发现其生产经营的食品属于不安全食品的，应当（  ）。,立即停止生产经营,采取通知或者公告的方式告知相关食品生产经营者停止生产经营、消费者停止食用,采取必要的措施防控食品安全风险,主动停产停业,"A,B,C"
多,多选题：食品生产经营者配合监督检查工作的义务包括（  ）。,开放食品生产经营场所,回答相关询问,提供相关合同、票据、账簿等材料,协助生产经营现场检查和抽样检验,"A,B,C,D"
多,多选题：食品生产经营者应当采取措施，改善食品（）、（）、（），防止食品变质，降低储存、运输中的损耗,储存,运输,加工条件,价格,"A,B,C"
多,多选题：食品生产经营者应当配合监督检查工作，提供相关（）等有关资料。,合同,票据,账簿,前次监督检查结果和整改情况,"A,B,C,D"
多,多选题：食品生产企业收到监督抽检不合格检验结论后，应当立即采取（）等风险控制措施。,封存不合格食品,暂停生产、经营不合格食品,通知相关生产经营者和消费者,召回已上市销售的不合格食品,"A,B,C,D"
多,多选题：食品生产企业应当建立不合格品管理制度，规定生产过程中发现的（）中不合格品的管理要求和处置措施。,原料,辅料,半成品,成品,"A,B,C,D"
多,多选题：食品生产企业应当就（）事项制定并实施控制要求，保证所生产的食品符合食品安全标准。,原料采购、原料验收、投料等原料控制,原料检验、半成品检验、成品出厂检验等检验控制,生产工序、设备、贮存、包装等生产关键环节控制,运输和交付控制,"A,B,C,D"
多,多选题：食品生产企业应当配合监督抽查考核工作，组织（）按要求参加考核。,企业主要负责人,食品安全总监,食品安全员,检验人员,"A,B,C"
多,多选题：食品生产企业应对照食品安全标准明确本企业各类食品生产过程中（）等具体要求。,卫生管理,污染控制,产品检验,贮存和运输控制,"A,B,C,D"
多,多选题：食品生产企业应及时了解食品安全监管部门发布的规范性文件规定，此类文件形式包括包括（）。,通知,公告,通则和细则,答复,"A,B,C,D"
多,多选题：食品生产企业在生产经营过程中违反《中华人民共和国刑法》，构成犯罪的，应当追究刑事责任，相关罪名有（）。,生产、销售伪劣产品罪,生产、销售不符合安全标准的食品罪,生产、销售有毒、有害食品罪,非法经营罪和虚假广告罪,"A,B,C,D"
多,多选题：食品生产者应当妥善保管食品生产许可证，不得（  ）。,伪造或涂改,倒卖,出租或出借,转让,"A,B,C,D"
多,多选题：食品生产者应当依照法律规定，建立食品安全追溯体系，保证（）。,原料来源可查,产品去向可追,生产过程可核,产品留样可检,"A,B,C,D"
多,多选题：食品添加剂新品种是指？,未列入食品安全国家标准的食品添加剂品种,未列入国务院卫生行政部门公告允许使用的食品添加剂品种,扩大使用范围或者用量的食品添加剂品种,已有使用习俗的食品添加剂品种,"A,B,C"
多,多选题：食品相关产品销售者应当建立并实施食品相关产品进货查验制度，验明供货者（  ），如实记录食品相关产品的名称、数量、进货日期以及供货者名称、地址、联系方式等内容，并保存相关凭证。,营业执照,相关许可证件,产品合格证明,产品标识,"A,B,C,D"
多,多选题：食品有下列（  ）情形的，应当在其标识上标注中文说明。,医学临床证明对特殊群体易造成危害的,经过电离辐射或者电离能量处理过的,属于转基因食品或者含法定转基因原料的,按照法律、法规和国家标准等规定，应当标注其他中文说明的,"A,B,C,D"
多,多选题：食品召回是指食品生产者按照规定程序，对由其生产原因造成的某一批次或类别的不安全食品，通过（）等方式，及时消除或减少食品安全危害的活动。,换货,退货,补充,修正消费说明,"A,B,C,D"
多,多选题：使用食品添加剂，不应当（  ）。,掩盖食品腐败变质,掩盖食品本身或者加工过程中的质量缺陷,降低食品本身的营养价值,改善食品品质,"A,B,C"
多,多选题：市场监督管理部门对食品生产经营者执行食品安全法律、法规、规章和食品安全标准等情况实施监督检查，监督检查形式包括（）。,日常监督检查（含“双随机”抽查检查）,飞行检查,体系检查,督导检查,"A,B,C"
多,多选题：属于《中华人民共和国食品安全法》第一百二十三条规定的“情节严重”，尚不构成犯罪的，公安机关可以对其直接负责的主管人员和其他直接责任人员处5日以上15日以下拘留，具体包括（  ）。,违法行为涉及的产品货值金额2万元以上的,违法行为持续时间3个月以上的,造成食源性疾病并出现死亡病例，或者造成30人以上食源性疾病但未出现死亡病例的,因违反食品安全法律、法规受到行政处罚后1年内又实施同一性质的食品安全违法行为，或者受到刑事处罚后又实施食品安全违法行为的,"A,B,C,D"
多,多选题：属于特殊食品的都有哪些？,保健食品,特殊医学用途配方食品,婴幼儿配方食品,膨化食品,"A,B,C"
多,多选题：所有食品生产经营者应当遵守的行政法规有（）。,《国务院关于加强食品等产品安全监督管理的特别规定》,《食盐专营办法》,《生猪屠宰管理条例》,《中华人民共和国食品安全法实施条例》,"A,B,C,D"
多,多选题：习近平总书记高度重视食品安全工作，多次就食品安全作出重要指示批示，强调要用（）、（）、（）、（），加快建立科学完善的食品安全治理体系，严把从农田到餐桌的每一道防线。,最严谨的标准,最严格的监管,最严厉的处罚,最严肃的问责,"A,B,C,D"
多,多选题：县级以上人民政府食品安全监督管理部门对违反食品管理法律、法规、规章的单位或者个人实施行政处罚，其处罚依据为（）等有关法律法规。,食品安全法,行政处罚法,安全生产法,行政强制法,"A,B,D"
多,多选题：销售者销售食用农产品，应当在销售场所明显位置或者带包装产品的包装上如实标明食用农产品的（  ）等信息。,名称,产地,生产者的名称或者姓名,销售者的名称或者姓名,"A,B,C,D"
多,多选题：新食品原料是指在我国无传统食用习惯的物品，以下属于新食品原料的是？,动物、植物和微生物,从动物、植物和微生物中分离的成分,原有结构发生改变的食品成分,其他新研制的食品原料,"A,B,C,D"
多,多选题：新食品原料是指在我国无传统食用习惯的以下物品（   ）。,动物、植物和微生物,从动物、植物和微生物中分离的成分,原有结构发生改变的食品成分,其他新研制的食品原料,"A,B,C,D"
多,多选题：以下哪些属于食品安全管理人员？,企业主要负责人,检验人员,食品安全总监,食品安全员,"A,C,D"
多,多选题：以下属于产品标准的是？,《食品安全国家标准 植物油》（GB 2716）,《食品安全国家标准 预包装食品中致病菌限量》（GB 29921）,《食品安全国家标准 蛋与蛋制品生产卫生规范》（GB 21710）,《食品安全国家标准 速冻面米与调制食品》（GB 19295）,"A,D"
多,多选题：以下属于规范性标准的是？,《食品安全国家标准 食品添加剂生产通用卫生规范》（GB 31647）,《食品安全国家标准 冷冻饮品和制作料》（GB 2759）,《食品安全国家标准 发酵酒及其配制酒生产卫生规范》（GB 12696）,《食品安全国家标准 动物性食品中头孢类药物残留量的测定 液相色谱－串联质谱法》（GB 31658.4）,"A,C"
多,多选题：以下属于食品的是？,供人食用或者饮用的成品,供人食用或者饮用的原料,以治疗为目的的物品,按照传统既是食品又是中药材的物品,"A,B,D"
多,多选题：以下属于食品生产企业的风险管控清单应当包括的内容是？,生产环境条件,生产过程控制,不合格食品管理和食品召回,信息记录和食品安全追溯体系,"A,B,C,D"
多,多选题：以下属于食品添加剂的是？,食品用香料,营养强化剂,胶基糖果中基础剂物质,食品工业用加工助剂,"A,B,C,D"
多,多选题：应通过对以下哪些方面的分析，确定加工过程中的关键环节？,生产环境,原料,关键生产工序,影响产品安全的人为因素,"B,C,D"
多,多选题：营养标签是指预包装食品标签上向消费者提供食品营养信息和特性的说明，包括（）。,营养成分表,配料表,营养声称,营养成分功能声称,"A,C,D"
多,多选题：在《中华人民共和国食品安全法》的基础上，《食品安全法实施条例》进一步明确了（）。,食品生产企业主体责任,食品安全标准执行,食品委托生产资质及责任,处罚到人制度,"A,B,C,D"
single,判断题：《企业落实食品安全主体责任监督管理规定》是为督促企业落实食品安全主体责任，强化企业主要负责人食品安全责任而制定。,√,×,,,B
single,判断题：《食品生产经营监督检查管理办法》适用于食品安全监督管理部门对食品（含食品添加剂）生产经营者执行食品安全法律、法规、规章和标准等情况实施监督检查。,√,×,,,A
single,判断题：《新食品原料安全性审查管理办法》为规范新食品原料安全性评估材料审查工作而制定。,√,×,,,A
single,判断题：《中华人民共和标准化法》规定，企业执行自行制定的企业标准的，还应当公开产品、服务的功能指标和产品的性能指标。,√,×,,,A
single,判断题：《中华人民共和国农产品质量安全法》规定了与农产品质量安全有关的农产品生产经营及其监督管理活动相关要求。,√,×,,,A
single,判断题：《中华人民共和国食品安全法》规定了生产经营者自查制度等要求，食品生产经营者要主动防范风险，通过定期对食品安全状况进行检查评价，发现不符合食品安全要求的，应当立即采取整改措施；发生食品安全事故潜在风险的，应当立即停止食品生产经营活动，并向所在地食品安全监督管理部门报告。,√,×,,,A
single,判断题：《中华人民共和国食品安全法》要求食品安全监管部门根据食品安全风险监测、风险评估结果和食品安全状况等，确定监督管理的重点、方式和频次，实施风险分级管理。,√,×,,,A
single,判断题：《中华人民共和国食品安全法实施条例》规定了食品安全监管部门和公安机关的协作机制，明确行政拘留与其他行政处罚的衔接程序。,√,×,,,A
single,判断题：《最高人民法院关于审理食品安全民事纠纷案件适用法律若干问题的解释》规定，经营者经营明知是不符合食品安全标准的食品，但向消费者承诺的赔偿标准高于食品安全法第一百四十八条规定的赔偿标准，消费者主张经营者按照承诺赔偿的，人民法院应当依法予以支持。,√,×,,,A
single,判断题：《最高人民法院关于审理食品安全民事纠纷案件适用法律若干问题的解释》规定，消费者因不符合食品安全标准的食品受到损害，依据食品安全法第一百四十八条第一款规定诉请食品生产者或者经营者赔偿损失，被诉的生产者或者经营者以赔偿责任应由生产经营者中的另一方承担为由主张免责的，人民法院予以支持。,√,×,,,B
single,判断题：保健食品可以声称或者暗示广告商品为保障健康所必需。,√,×,,,B
single,判断题：保健食品可以与药品、其他保健食品进行比较。,√,×,,,B
single,判断题：不安全食品是指食品安全法律法规规定禁止生产经营的食品以及其他有证据证明可能危害人体健康的食品。,√,×,,,A
single,判断题：不以掺杂、掺假、伪造为目的而使用食品添加剂。,√,×,,,A
single,判断题：餐饮服务经营者应在引导消费者按需适量点餐，提升餐饮供给质量，按照标准规范制作食品，合理确定数量、分量，提供小份餐等不同规格选择。,√,×,,,A
single,判断题：产品缺陷由生产者造成的，销售者赔偿后，不得向生产者追偿。,√,×,,,B
single,判断题：从事生猪产品销售、肉食品生产加工的单位和个人以及餐饮服务经营者、集中用餐单位生产经营的生猪产品，必须是生猪定点屠宰厂（场）经检疫和肉品品质检验合格的生猪产品。,√,×,,,A
single,判断题：单位从事食品药品违法行为的，除对单位进行处罚外，还要依法追究单位直接负责的主管人员和其他直接责任人员责任。,√,×,,,A
single,判断题：地方食品安全条例由地方省级人民代表大会根据国家有关法律法规，结合本省（区、市）实际制定，适用于在本行政区域内食品生产经营及其监督管理。,√,×,,,A
single,判断题：电子商务经营者从事经营活动，依法需要取得相关行政许可的，应当依法取得行政许可。,√,×,,,A
single,判断题：电子商务平台经营者应当要求申请进入平台销售商品或者提供服务的经营者提交其身份、地址、联系方式、行政许可等真实信息，进行核验、登记，建立登记档案，并定期核验更新。,√,×,,,A
single,判断题：对于性质恶劣的违反食品安全法律法规的行为，应当先考虑适用刑罚，后考虑适用行政处罚，防止以罚代刑。,√,×,,,A
single,判断题：飞行检查指市场监督管理部门根据监督管理工作需要以及问题线索等，对食品生产经营者依法开展的不预先告知的监督检查。,√,×,,,A
single,判断题：非食用物质是指添加或者可能添加到食品中的非食品用化学物质和其他可能危害人体健康的物质。,√,×,,,A
single,判断题：分隔是指通过在物品、设施、区域之间留有一定空间，而非通过设置物理阻断的方式进行隔离。,√,×,,,B
single,判断题：分离是指通过在物品、设施、区域之间留有一定空间等非物理阻断的方式进行隔离。,√,×,,,A
single,判断题：根据《中华人民共和国食品安全法》的规定，预包装食品标签应当标明“产品标准名称”。,√,×,,,B
single,判断题：根据《中华人民共和国食品安全法》规定，为贯彻落实食品安全法，切实加强对食品安全工作的领导，国务院设立食品安全委员会，其职责由全国人大规定。,√,×,,,B
single,判断题：根据《中华人民共和国食品安全法》规定，县级以上地方人民政府实行食品安全监督管理责任制。,√,×,,,A
single,判断题：鼓励食品生产经营企业符合良好生产规范要求，实施危害分析与关键控制点体系。,√,×,,,A
single,判断题：关键工艺参数一般是指食品生产加工中重要工艺的控制参数，该工艺参数发生改变后可影响食品关键质量或安全特性。,√,×,,,A
single,判断题：国家出入境检验检疫部门（海关）对进出口食品安全实施监督管理。,√,×,,,A
single,判断题：国家粮食和物资储备局负责粮食流通监督检查，负责粮食收购、储存、运输环节粮食质量安全和原粮卫生的监督管理，组织实施全国粮食库存检查工作。,√,×,,,A
single,判断题：国务院食品安全委员会具体工作由国家市场监督管理总局承担。,√,×,,,A
single,判断题：国务院食品安全委员会组织开展食品安全风险监测评估，依法制定并公布食品安全标准。,√,×,,,B
single,判断题：含有食品添加剂的食品一定是不安全的。,√,×,,,B
single,判断题：化学性污染是指有害化学物质对食品的污染。,√,×,,,A
single,判断题：接触表面是指食品生产过程中的设备、工器具、人体等可能被食品接触到的表面。,√,×,,,A
single,判断题：经检测不符合农产品质量安全标准的农产品，应当及时采取管控措施，但可以继续销售。,√,×,,,B
single,判断题：农药最大残留限量是指按照食品安全国家标准规定，在食品或农产品表面法定允许的农药最大浓度。,√,×,,,B
single,判断题：农业农村部负责农产品质量安全监督管理。组织开展农产品质量安全监测、追溯、风险评估。提出技术性贸易措施建议。参与制定农产品质量安全国家标准并会同有关部门组织实施。指导农业检验检测体系建设。,√,×,,,A
single,判断题：批发市场开办者需配备食品安全员，可以不配备食品安全总监。,√,×,,,B
single,判断题：企业应当配合食品安全事故调查部门开展调查工作，按照要求提供相关资料和样品。,√,×,,,A
single,判断题：日常监督检查指市级、县级市场监督管理部门按照年度食品生产经营监督检查计划，对本行政区域内食品生产经营者开展的常规性检查。,√,×,,,A
single,判断题：乳制品生产企业不得向未取得生鲜乳收购许可证的单位和个人购进生鲜乳。,√,×,,,A
single,判断题：乳制品生产企业不得向未取得生鲜乳收购许可证的单位和个人购进生鲜乳。,√,×,,,A
single,判断题：生产、销售不符合食品安全标准的食品，应当认定为《中华人民共和国刑法》第一百四十三条规定的“足以造成严重食物中毒事故或者其他严重食源性疾病”“对人体健康造成严重危害”“其他严重情节”“后果特别严重”的情形。,√,×,,,A
single,判断题：生产、销售伪劣产品罪是指生产者、销售者在产品中掺杂、掺假，以假充真，以次充好或者以不合格产品冒充合格产品。,√,×,,,A
single,判断题：生产经营者财产不足以同时承担民事赔偿责任和缴纳罚款、罚金时，先承担民事赔偿责任。,√,×,,,A
single,判断题：食品、食品添加剂、食品相关产品的生产者，应当按照食品安全标准对所生产的食品、食品添加剂、食品相关产品进行检验，检验合格后方可出厂或者销售。,√,×,,,A
single,判断题：食品、食品添加剂的生产者，应当按照食品安全标准对所生产的食品、食品添加剂进行检验，检验合格后方可出厂或者销售。,√,×,,,A
single,判断题：食品安全事故指食源性疾病、食品污染等源于食品，对人体健康有危害或者可能有危害的事故。,√,×,,,A
single,判断题：食品安全总监、食品安全员发现有食品安全事故潜在风险的，无权提出停止相关食品生产经营活动等否决建议。,√,×,,,B
single,判断题：食品安全总监、食品安全员应当按照岗位职责协助企业主要负责人做好食品安全管理工作。,√,×,,,A
single,判断题：食品包括按照传统既是食品又是中药材的物品。,√,×,,,A
single,判断题：食品包括以治疗为目的物品。,√,×,,,B
single,判断题：食品保质期是指食品在标明的贮存条件下保持品质的期限。,√,×,,,A
single,判断题：食品标识上的注册商标必须使用中文。,√,×,,,B
single,判断题：食品产品配方和工艺过程应符合相应的食品安全标准。,√,×,,,A
single,判断题：食品的产品配方一般指食品生产加工使用的各种营养素。,√,×,,,B
single,判断题：食品的贮存和运输无需遵守《中华人民共和国食品安全法》的规定。,√,×,,,B
single,判断题：食品辐照是指利用电离辐射在食品中产生的辐射化学与辐射微生物学效应而达到抑制发芽、延迟或促进成熟、杀虫、杀菌、灭菌和防腐等目的的辐照过程。,√,×,,,A
single,判断题：食品辅料一般是指加工食品时使用量较小的一种或多种物料。,√,×,,,A
single,判断题：食品加工场所是指用于食品加工处理的建筑物和场地，以及按照相同方式管理的其他建筑物、场地和周围环境等。,√,×,,,A
single,判断题：食品加工是指改变食品原料或半成品形状、大小、性质、纯度，使之符合食品标准的各种操作。,√,×,,,A
single,判断题：食品良好生产规范（Good Manufacturing Practice，GMP）是指为保证食品质量安全而制定的贯穿于食品生产全过程的一系列方法、技术要求和监控措施，是一种特别注重在生产过程中实施对产品质量与卫生安全的被动性管理的制度。,√,×,,,B
single,判断题：食品配料是指在制造或加工食品时使用的并存在（包括以改性形式存在）于最终产品的任何物质，包括水和食品添加剂。,√,×,,,A
single,判断题：食品生产经营企业应当建立健全主要负责人负总责，食品安全总监、食品安全员分级负责的责任体系。,√,×,,,A
single,判断题：食品生产经营企业应当依法配备与企业规模、食品类别、风险等级、管理水平、安全状况等相适应的食品安全总监、食品安全员等食品安全管理人员。,√,×,,,A
single,判断题：食品生产经营企业应当制定食品安全风险管控清单，建立健全“日管控、周排查、月调度”工作制度和机制。,√,×,,,A
single,判断题：食品生产经营企业主要负责人是指在本企业生产经营中承担全面领导责任的法定代表人、实际控制人等主要决策人。,√,×,,,A
single,判断题：食品生产经营者停止生产经营、召回和处置不安全食品，可以免除其他法律责任。,√,×,,,B
single,判断题：食品生产经营者应当建立食品安全追溯体系，保证食品可追溯。,√,×,,,A
single,判断题：食品生产经营者应当落实主体责任，强化道德观念，倡导诚信从业风气，促使食品安全保障由单纯依靠食品安全监管部门向多方主体主动参与，共同发挥作用的综合治理转变。,√,×,,,A
single,判断题：食品生产批次是指在食品生产过程中，根据一定的标准和要求，将生产的食品按照一定的数量或时间范围进行分类和管理的一种方法。,√,×,,,A
single,判断题：食品生产企业采购生猪产品，只需查验检疫证明即可。,√,×,,,B
single,判断题：食品生产企业已经有类似工作机制的，可以将原有制度与日管控、周排查、月调度工作机制相结合继续执行。,√,×,,,A
single,判断题：食品生产企业应当建立食品原料、食品添加剂、食品相关产品进货查验记录制度。,√,×,,,A
single,判断题：食品生产企业应当就原料检验、半成品检验、成品出厂检验等检验控制事项制定并实施控制要求，保证所生产的食品符合食品安全标准。,√,×,,,A
single,判断题：食品生产企业应当遵守广告法等法律规定，禁止在大众传播媒介或者公共场所发布声称全部或者部分替代母乳的婴儿乳制品、饮料和其他食品广告。,√,×,,,A
single,判断题：食品生产企业应对照相关食品安全国家标准规定，准确、规范标示产品标签和说明书。,√,×,,,A
